{
  "schema_version": 1,
  "policy_id": "policy_single_car_candidate_manual_promote_v0.6",
  "name": "Single car candidate deploy then manual promote for ADAS v0.6",
  "description": "Deploy ADAS v0.6 as candidate to one vehicle, verify logs, then manually promote to primary.",
  "stages": [
    {
      "stage_id": "candidate_deploy",
      "stage_name": "candidate",
      "deploy_action": "candidate",
      "require_ota_ready": true,
      "docker_runtime": {
        "enabled": true,
        "pull_policy": "missing"
      },
      "success_criteria": {
        "docker_runtime_result": "success",
        "expected_log_patterns": [
          "[ADAS v0.6]",
          "Candidate Shadow version is running"
        ]
      }
    },
    {
      "stage_id": "manual_approval",
      "stage_name": "approval",
      "action": "wait_for_manual_approval",
      "required": true
    },
    {
      "stage_id": "primary_promote",
      "stage_name": "promote",
      "deploy_action": "promote",
      "require_candidate_running": true,
      "success_criteria": {
        "docker_runtime_result": "success",
        "primary_log_patterns": [
          "[ADAS v0.6]",
          "Primary production path running"
        ]
      }
    }
  ],
  "health_checks": {
    "forbid_kill_switch": true,
    "require_safe_update_mode": true,
    "max_failure_rate_percent": 0
  },
  "on_failure": "pause_campaign"
}
